{
  "$schema": "https://json-schema.org/draft/2020-12/schema",
  "$id": "https://godiesel.world/schemas/world-pack/v1/checksums.schema.json",
  "title": "World Pack checksum inventory",
  "type": "object",
  "additionalProperties": false,
  "required": ["schemaVersion", "packId", "algorithm", "files"],
  "properties": {
    "schemaVersion": { "const": 1 },
    "packId": { "type": "string", "pattern": "^wp_[0-9a-f]{64}$" },
    "algorithm": { "const": "sha256" },
    "files": {
      "type": "array",
      "minItems": 1,
      "items": {
        "type": "object",
        "additionalProperties": false,
        "required": ["path", "sha256", "byteSize"],
        "properties": {
          "path": {
            "type": "string",
            "minLength": 1,
            "pattern": "^(?!/)(?!.*(?:^|/)\\.\\.(?:/|$))[A-Za-z0-9._/-]+$"
          },
          "sha256": { "type": "string", "pattern": "^[0-9a-f]{64}$" },
          "byteSize": { "type": "integer", "minimum": 0 }
        }
      }
    }
  }
}
