{"algorithm":"sha256","files":[{"byteSize":4088,"path":"cinematic/camera-timelines.json","sha256":"bb81f64f79c7ca68079bd4e762f7b308d8f363dd910426cc1625b4afa4516256"},{"byteSize":429,"path":"cinematic/experience-manifest.json","sha256":"3e124c95e8e99b8eefc16deb93ddf7258201b17c94d48efc7ebfabedcd530de2"},{"byteSize":78,"path":"cinematic/poster-candidates.json","sha256":"4424c34a0c4e771e5a230c54335d9c1fe6d6c6a75bd53260f79aa4bc87939367"},{"byteSize":109,"path":"imagery/materials/procedural.json","sha256":"576c10eaf5c9916fe8bee7e7116b9bb2a7c867aabdc705d4d2c83c00cc398775"},{"byteSize":191,"path":"lod/core.json","sha256":"323c35f77fac7f0be4736d750ef198f6ac104b05d4195c43c7d104e9a363234b"},{"byteSize":10779,"path":"manifest.json","sha256":"e0673bdb16149570379647b5bc9cd6f1457e615f813250ab5a33416e43e4f388"},{"byteSize":98,"path":"migrations/version.json","sha256":"a7f683072d760d4fa368ea6cd3b2be0c4cd2673df61e35cb10a49a56927d2a6a"},{"byteSize":208,"path":"physics/structures-collision.glb","sha256":"730ba806edfe2a40fa729cc33ffd02ff1f74e19267726c40701b848d687151a3"},{"byteSize":2323444,"path":"physics/terrain-collision.glb","sha256":"aecd98a78ce56c4ff010f2cd66e594ec57230ee44fa789c3f1df2089fa229fb8"},{"byteSize":6267,"path":"physics/terrain-mask.json","sha256":"b58e3f167e9a9cebdc1393addac91365c8a36cb4d56bcdfec859672b5594b50d"},{"byteSize":10596,"path":"physics/traversable-surfaces.glb","sha256":"4660ec1cbcec0e9d653204fe6c693ad7d6fa3742ed4b5ff9d7c307ab373d5355"},{"byteSize":51262,"path":"physics/world-navigation.json","sha256":"079d764dc0a764cf81f83b9fb9076146e15fe41b66015fb44d150ac891a31b48"},{"byteSize":222,"path":"provenance/accuracy.json","sha256":"3a163b1b782f1063cb44f04c2aa1dc881d1b13afd1a25b45ed36adb4e6d8e7f2"},{"byteSize":450,"path":"provenance/attribution.json","sha256":"277a0ad32d61fa19f58736347c1e15ef82f771d7de98ef684202eb233d85e788"},{"byteSize":417464,"path":"provenance/coverage.json","sha256":"9f7505f7252a0a4218a393753d655bd99e3d5d5ca18c29ddc49e2f4475843e46"},{"byteSize":8481,"path":"provenance/transformations.json","sha256":"6e4dd395c14dd83a5c7a78bdd20854140315e2167a05fceba4ca1afdbc881ec3"},{"byteSize":56,"path":"reconstruction/inventory.json","sha256":"d3038a11fa3116de04981567121106ac976237e09a50576a670d6b454c7d1298"},{"byteSize":31,"path":"route/annotations.json","sha256":"9f1a21f3872c8655bb71bcc8fe4abfc9e0fd69599c4e4a1fe62dd708a8030efd"},{"byteSize":27977,"path":"route/canonical-route.json","sha256":"6bb4d7c336df27935c93c46be4ec9611ad2b82247eee8bfe682e0e4c0cb538fa"},{"byteSize":31,"path":"route/media-index.json","sha256":"9f1a21f3872c8655bb71bcc8fe4abfc9e0fd69599c4e4a1fe62dd708a8030efd"},{"byteSize":3020,"path":"route/route-thread.glb","sha256":"c1d8274f18f2bccf6a7ae3274c48b22cd6357b83daf7ae3648969d916d4be62e"},{"byteSize":864,"path":"runtime/world.json","sha256":"29c3e6eedf8223ffe63aec2f7ff17a5898291a56e06386571569013a66f4438f"},{"byteSize":490508,"path":"sources/derived/normalized-terrain.json","sha256":"cb1df3a0dce036a9769d4f288f64d95c611ba47dfe2ae3d23050187853a2819b"},{"byteSize":1289,"path":"sources/inventory.json","sha256":"967b280b5b2daf090ef8c85f7815c613c7fcb0b7c78d506d2048f581c36f9efd"},{"byteSize":28577,"path":"sources/original/route-detail.json","sha256":"e3b686096040cc905228fe9cacce67d625ed1b68f06d7c27c5381175e586bf63"},{"byteSize":56,"path":"structures/tileset.json","sha256":"f3734f2797a87ed0aa330b85d06e55a7e3821fc7ca6be7bb283afd5fde35d260"},{"byteSize":4140020,"path":"terrain/surface/core-terrain.glb","sha256":"636b31e826fdfb29813ef86a616ec1943703717bc4f9cc225eb716679e4a552a"},{"byteSize":159,"path":"transportation/network.json","sha256":"8a5b1579f878740b032eda0ebd04c72d5323a508b24ddb477b3fe187268694d6"}],"packId":"wp_9e5fbe74c2963d77e2dad71f6909d442c56d0cbb2b8b0d2aad44145082e5fb98","schemaVersion":1}
