{"algorithm":"sha256","files":[{"byteSize":4133,"path":"cinematic/camera-timelines.json","sha256":"385418d37a2387b6e5319616a291f3fa220efc220d3f04ab9781d9ca57b0dd03"},{"byteSize":428,"path":"cinematic/experience-manifest.json","sha256":"405c8174b124e45f3e4fb32a7f3550138eb78781c4cea2b1544c3e9774d5215c"},{"byteSize":78,"path":"cinematic/poster-candidates.json","sha256":"e7aacfc234ffbb744ee500cdcff008ebf1db736147bee10cfd8250e2d4e5a623"},{"byteSize":109,"path":"imagery/materials/procedural.json","sha256":"576c10eaf5c9916fe8bee7e7116b9bb2a7c867aabdc705d4d2c83c00cc398775"},{"byteSize":191,"path":"lod/core.json","sha256":"323c35f77fac7f0be4736d750ef198f6ac104b05d4195c43c7d104e9a363234b"},{"byteSize":10019,"path":"manifest.json","sha256":"247fa78a77ec8a78fbd89f647defc3c0664093b8d1a3d0721bda4faf9322b79b"},{"byteSize":98,"path":"migrations/version.json","sha256":"9d1f6bcfb08424a33d8d6440340558cc9935e57e58d16db1d1aa06b62189703a"},{"byteSize":208,"path":"physics/structures-collision.glb","sha256":"730ba806edfe2a40fa729cc33ffd02ff1f74e19267726c40701b848d687151a3"},{"byteSize":46980,"path":"physics/terrain-collision.glb","sha256":"970427c0a838a22406b49c55d9ea6ffd0c5f7197b267038fb59d0d6864af9991"},{"byteSize":19968,"path":"physics/traversable-surfaces.glb","sha256":"a1224006b9eb668d2b62fa23b921c5f0f78b96b34a1229a6b62a66b1632159a1"},{"byteSize":100764,"path":"physics/world-navigation.json","sha256":"f89d14ca322f87c4d004e8e96f90bbd7fc2df2f4330669e6410eea3d78f2d2c4"},{"byteSize":191,"path":"provenance/accuracy.json","sha256":"3e0aa4322e5d8d3f0db312cbdfcc73289dc53f81b52533b763c53291288f5654"},{"byteSize":275,"path":"provenance/attribution.json","sha256":"fd6392193c63238f796a93a5e716447e8adf3a89aaaceebe55942e9aa87827d3"},{"byteSize":782575,"path":"provenance/coverage.json","sha256":"a985ca016d0c53d05bab2332c5c55eaa824184eac5908a66f9bda47381c901f3"},{"byteSize":8121,"path":"provenance/transformations.json","sha256":"2dfb56252530bac0c7f4855dff7caa69aff0ffdb53170ef472328dce3ea718c8"},{"byteSize":56,"path":"reconstruction/inventory.json","sha256":"d3038a11fa3116de04981567121106ac976237e09a50576a670d6b454c7d1298"},{"byteSize":31,"path":"route/annotations.json","sha256":"9f1a21f3872c8655bb71bcc8fe4abfc9e0fd69599c4e4a1fe62dd708a8030efd"},{"byteSize":52364,"path":"route/canonical-route.json","sha256":"62d526cc4094ce3cf4621856709550520074142520ba13c5baa18b99ca6cf2d6"},{"byteSize":31,"path":"route/media-index.json","sha256":"9f1a21f3872c8655bb71bcc8fe4abfc9e0fd69599c4e4a1fe62dd708a8030efd"},{"byteSize":8644,"path":"route/route-thread.glb","sha256":"301e6c956b73ccf4f742f634b1ece16acd49c340297e3bbf4288025707cca54f"},{"byteSize":668,"path":"runtime/world.json","sha256":"a6f546207632066cca51d290787c8b0edc5d09ccd058bd5a48aacee51687ebfc"},{"byteSize":627,"path":"sources/inventory.json","sha256":"6c4334c37bfc2f804306181b53165a0b54e48ac6ba6083eb654692dfb6790192"},{"byteSize":52331,"path":"sources/original/route-detail.json","sha256":"666e7bcc2b7214ca24703ecd66470a963af1df1e11b5bc9fbc182258aba820f6"},{"byteSize":56,"path":"structures/tileset.json","sha256":"f3734f2797a87ed0aa330b85d06e55a7e3821fc7ca6be7bb283afd5fde35d260"},{"byteSize":46984,"path":"terrain/surface/core-terrain.glb","sha256":"1ad23a24a8f276248fea21172b5d24b06de8d90549cd23fdda5618011ecce61d"},{"byteSize":159,"path":"transportation/network.json","sha256":"8a5b1579f878740b032eda0ebd04c72d5323a508b24ddb477b3fe187268694d6"}],"packId":"wp_21582d5028ed3488df48be0f6b1e5add3109e1f05db12ab7d904d501985f6733","schemaVersion":1}
