{"algorithm":"sha256","files":[{"byteSize":19781,"path":"cinematic/camera-timelines.json","sha256":"fc3bfc751e5e214d59001ea36809b5f15986d09689ac5f55e1930afa2f6f5a2c"},{"byteSize":429,"path":"cinematic/experience-manifest.json","sha256":"f2f54a24f2a6547c8f740e9f48d161708ea2f92bfe40dfec8440635f0b98774a"},{"byteSize":78,"path":"cinematic/poster-candidates.json","sha256":"4424c34a0c4e771e5a230c54335d9c1fe6d6c6a75bd53260f79aa4bc87939367"},{"byteSize":109,"path":"imagery/materials/procedural.json","sha256":"576c10eaf5c9916fe8bee7e7116b9bb2a7c867aabdc705d4d2c83c00cc398775"},{"byteSize":191,"path":"lod/core.json","sha256":"323c35f77fac7f0be4736d750ef198f6ac104b05d4195c43c7d104e9a363234b"},{"byteSize":11870,"path":"manifest.json","sha256":"254f0fd418f59f45e63418140e5515b4e39d27de527bb88278b37d5c9b4edbb5"},{"byteSize":98,"path":"migrations/version.json","sha256":"a7f683072d760d4fa368ea6cd3b2be0c4cd2673df61e35cb10a49a56927d2a6a"},{"byteSize":313536,"path":"physics/structures-collision.glb","sha256":"97012248a01b9132372417c631cc04bd6c6b6045c7b3f29308ad99e8d0f0f503"},{"byteSize":2323444,"path":"physics/terrain-collision.glb","sha256":"aecd98a78ce56c4ff010f2cd66e594ec57230ee44fa789c3f1df2089fa229fb8"},{"byteSize":6267,"path":"physics/terrain-mask.json","sha256":"b58e3f167e9a9cebdc1393addac91365c8a36cb4d56bcdfec859672b5594b50d"},{"byteSize":15336,"path":"physics/traversable-surfaces.glb","sha256":"a360c40cb5783ea3ec4aa38868162ade0b2be2957f96dccdb4203354004fb070"},{"byteSize":51262,"path":"physics/world-navigation.json","sha256":"079d764dc0a764cf81f83b9fb9076146e15fe41b66015fb44d150ac891a31b48"},{"byteSize":222,"path":"provenance/accuracy.json","sha256":"3a163b1b782f1063cb44f04c2aa1dc881d1b13afd1a25b45ed36adb4e6d8e7f2"},{"byteSize":563,"path":"provenance/attribution.json","sha256":"457dd38d3f55bf7c9b58a1233a70cd6a69ed4fb6a37adda35a79ad695044421f"},{"byteSize":425106,"path":"provenance/coverage.json","sha256":"a8dc28ca1b564329205e3ed231960cc43ba6993f384a2791e93037453ab567c9"},{"byteSize":8472,"path":"provenance/transformations.json","sha256":"c9778788845cdb88587e61fd5274d70fd3dcf67c2a751c7da85fb938869984b7"},{"byteSize":56,"path":"reconstruction/inventory.json","sha256":"d3038a11fa3116de04981567121106ac976237e09a50576a670d6b454c7d1298"},{"byteSize":31,"path":"route/annotations.json","sha256":"9f1a21f3872c8655bb71bcc8fe4abfc9e0fd69599c4e4a1fe62dd708a8030efd"},{"byteSize":27977,"path":"route/canonical-route.json","sha256":"6bb4d7c336df27935c93c46be4ec9611ad2b82247eee8bfe682e0e4c0cb538fa"},{"byteSize":31,"path":"route/media-index.json","sha256":"9f1a21f3872c8655bb71bcc8fe4abfc9e0fd69599c4e4a1fe62dd708a8030efd"},{"byteSize":3020,"path":"route/route-thread.glb","sha256":"c1d8274f18f2bccf6a7ae3274c48b22cd6357b83daf7ae3648969d916d4be62e"},{"byteSize":869,"path":"runtime/world.json","sha256":"1c85a2f3673a603736f89c028f2735154d598f5186c7333939ab2bb4abf984fc"},{"byteSize":490508,"path":"sources/derived/normalized-terrain.json","sha256":"cb1df3a0dce036a9769d4f288f64d95c611ba47dfe2ae3d23050187853a2819b"},{"byteSize":315790,"path":"sources/derived/osm-route-world.json","sha256":"7b5873c27230f8ea10a4e52a0d591f2f0de2241c9d67459c31d49e90a37f2e9e"},{"byteSize":3233,"path":"sources/inventory.json","sha256":"f2a40e54d17c272102dc0fe005f6af9409d783c9fea42b2401b89336220d009a"},{"byteSize":284978,"path":"sources/original/osm-overpass/000.json","sha256":"1ee0bfdf84f82c91b1952050bb44afb75293124eaff828553e83acf28b2d7594"},{"byteSize":485131,"path":"sources/original/osm-overpass/001.json","sha256":"aa94c0ce834ad91f60d68067c066a7ced878d64031ba23519a402a5e5f17d7eb"},{"byteSize":28577,"path":"sources/original/route-detail.json","sha256":"e3b686096040cc905228fe9cacce67d625ed1b68f06d7c27c5381175e586bf63"},{"byteSize":56,"path":"structures/tileset.json","sha256":"f3734f2797a87ed0aa330b85d06e55a7e3821fc7ca6be7bb283afd5fde35d260"},{"byteSize":4140020,"path":"terrain/surface/core-terrain.glb","sha256":"636b31e826fdfb29813ef86a616ec1943703717bc4f9cc225eb716679e4a552a"},{"byteSize":193010,"path":"transportation/network.json","sha256":"849d4dff30eaed6a1931acf8e5c20924ffdb311eea6bdff45f0da55ce7a65c3c"}],"packId":"wp_c26dca2c4573447722b90223b037cda5681ea248605765bbbe588353bb41b90c","schemaVersion":1}
