{"algorithm":"sha256","files":[{"byteSize":4083,"path":"cinematic/camera-timelines.json","sha256":"b027e22cb155043a21919e406390dec752546ab7987c436802cd71a40737d47d"},{"byteSize":425,"path":"cinematic/experience-manifest.json","sha256":"d99f30287aeb8038b9a42dd2b7ce0926bb94400448c9786e2b21519d7e282f08"},{"byteSize":78,"path":"cinematic/poster-candidates.json","sha256":"1bcca688a308c837772d81de693a72b1b4b3c80d74fd65ad3e2bf9d6c12ba23e"},{"byteSize":109,"path":"imagery/materials/procedural.json","sha256":"576c10eaf5c9916fe8bee7e7116b9bb2a7c867aabdc705d4d2c83c00cc398775"},{"byteSize":191,"path":"lod/core.json","sha256":"323c35f77fac7f0be4736d750ef198f6ac104b05d4195c43c7d104e9a363234b"},{"byteSize":10015,"path":"manifest.json","sha256":"14b421fd947583308f185735541e9ed7c859820d7f1e3df342ca17f3a3d9a0e2"},{"byteSize":98,"path":"migrations/version.json","sha256":"9d1f6bcfb08424a33d8d6440340558cc9935e57e58d16db1d1aa06b62189703a"},{"byteSize":208,"path":"physics/structures-collision.glb","sha256":"730ba806edfe2a40fa729cc33ffd02ff1f74e19267726c40701b848d687151a3"},{"byteSize":36976,"path":"physics/terrain-collision.glb","sha256":"1fb71db70c7810e87c5a79181cb686b87bf85425b06439e16e7c1eb5924fb7a1"},{"byteSize":19092,"path":"physics/traversable-surfaces.glb","sha256":"ebd56a1b3ad46f7dfd35cf29b09af631e5e1c422089e943a14e9a577be7b7c33"},{"byteSize":96038,"path":"physics/world-navigation.json","sha256":"9d9ca9b466d04f4345525d966adffe1d7011f03473903f7c1893b77e8ea53857"},{"byteSize":191,"path":"provenance/accuracy.json","sha256":"3e0aa4322e5d8d3f0db312cbdfcc73289dc53f81b52533b763c53291288f5654"},{"byteSize":275,"path":"provenance/attribution.json","sha256":"fd6392193c63238f796a93a5e716447e8adf3a89aaaceebe55942e9aa87827d3"},{"byteSize":623298,"path":"provenance/coverage.json","sha256":"a7f37c3bbffddf36be5779a18a9ca123941725deafc4f21ffbcb505656e61ff6"},{"byteSize":8121,"path":"provenance/transformations.json","sha256":"e7849e001ca9e4101d89d793c5ba37d8cc2fd89473c5f60107b5f07b5b0254a4"},{"byteSize":56,"path":"reconstruction/inventory.json","sha256":"d3038a11fa3116de04981567121106ac976237e09a50576a670d6b454c7d1298"},{"byteSize":31,"path":"route/annotations.json","sha256":"9f1a21f3872c8655bb71bcc8fe4abfc9e0fd69599c4e4a1fe62dd708a8030efd"},{"byteSize":51888,"path":"route/canonical-route.json","sha256":"4fb49cf9219aded7c84f79a614a0cfc259c8cd845378d413e9272b42d58ca348"},{"byteSize":31,"path":"route/media-index.json","sha256":"9f1a21f3872c8655bb71bcc8fe4abfc9e0fd69599c4e4a1fe62dd708a8030efd"},{"byteSize":8264,"path":"route/route-thread.glb","sha256":"8eaac90899dc7bc7bc062b0556dcb2e82cb9fa748c04b65476844b79360c9de7"},{"byteSize":816,"path":"runtime/world.json","sha256":"afedc38222f27f026325a44a4050c56e35b0788781ef23cc9bc17e8ac3ee9764"},{"byteSize":627,"path":"sources/inventory.json","sha256":"e3c5b308bc9c5cad7fc83c3d9350a841ba71c9337fb4aed98817bfecff463708"},{"byteSize":51747,"path":"sources/original/route-detail.json","sha256":"21e5254dd4b4249562acaf3b91b56b3bddf205a283882d75121bf8ff0a66ac3f"},{"byteSize":56,"path":"structures/tileset.json","sha256":"f3734f2797a87ed0aa330b85d06e55a7e3821fc7ca6be7bb283afd5fde35d260"},{"byteSize":36976,"path":"terrain/surface/core-terrain.glb","sha256":"31944206abc1f0a4404e505dccd9c52a05548f8aeece839d5e9eeb6215463485"},{"byteSize":159,"path":"transportation/network.json","sha256":"8a5b1579f878740b032eda0ebd04c72d5323a508b24ddb477b3fe187268694d6"}],"packId":"wp_72a5535ba78c3de302568dc341bbd6e3e6542dbc239c8be3f926411fad709248","schemaVersion":1}
