{"algorithm":"sha256","files":[{"byteSize":20300,"path":"cinematic/camera-timelines.json","sha256":"8867aaeee533eb6a83630f61c14b1e5b3fab71c1b52ff07a00a523c6346b4551"},{"byteSize":428,"path":"cinematic/experience-manifest.json","sha256":"813ddaa895bf59272dbfa7bb942e3a1333a62236bb91d52b4995416f356691a1"},{"byteSize":78,"path":"cinematic/poster-candidates.json","sha256":"e7aacfc234ffbb744ee500cdcff008ebf1db736147bee10cfd8250e2d4e5a623"},{"byteSize":109,"path":"imagery/materials/procedural.json","sha256":"576c10eaf5c9916fe8bee7e7116b9bb2a7c867aabdc705d4d2c83c00cc398775"},{"byteSize":191,"path":"lod/core.json","sha256":"323c35f77fac7f0be4736d750ef198f6ac104b05d4195c43c7d104e9a363234b"},{"byteSize":11875,"path":"manifest.json","sha256":"5c1810c3fbefc4a15d09f8e65d34118377974037a532526c6bd6ec13c79c8b5b"},{"byteSize":98,"path":"migrations/version.json","sha256":"a7f683072d760d4fa368ea6cd3b2be0c4cd2673df61e35cb10a49a56927d2a6a"},{"byteSize":1912132,"path":"physics/structures-collision.glb","sha256":"a666815f42a9b8cb9d26aaf163a436ad91391260fc6874ff8d21240c0abb0ee3"},{"byteSize":3098216,"path":"physics/terrain-collision.glb","sha256":"ab96e33e544033c27d1cf151075992f21483c22bd42ce495e41823cf8440c8d1"},{"byteSize":103,"path":"physics/terrain-mask.json","sha256":"f0fc083382acd679275ac6b457bc0096fc1ac55db02ef9fb19e0b7e86d4e33e9"},{"byteSize":29240,"path":"physics/traversable-surfaces.glb","sha256":"8bbc196e32a3ec0758652b350101e612e6d531b834203474930593a8c100d34f"},{"byteSize":100764,"path":"physics/world-navigation.json","sha256":"f89d14ca322f87c4d004e8e96f90bbd7fc2df2f4330669e6410eea3d78f2d2c4"},{"byteSize":224,"path":"provenance/accuracy.json","sha256":"ebaaf66a4ea9fdabb1a61f7c3733c0ff82bab99f54b1ea40c399affdce7ae2fd"},{"byteSize":805,"path":"provenance/attribution.json","sha256":"541f96ceb4a074e5ceade496191a7b8a558cf0cd6faf0319600a328483dcdfd4"},{"byteSize":804400,"path":"provenance/coverage.json","sha256":"10600f90b11393bc095460ce1ea5aeb0f525d5812c88df7e55e427b656e1cde9"},{"byteSize":8472,"path":"provenance/transformations.json","sha256":"7e1fdd30c1a0f39570e7a2e8547b68ffe4145ade966503d86e5db54d0fcede9b"},{"byteSize":56,"path":"reconstruction/inventory.json","sha256":"d3038a11fa3116de04981567121106ac976237e09a50576a670d6b454c7d1298"},{"byteSize":31,"path":"route/annotations.json","sha256":"9f1a21f3872c8655bb71bcc8fe4abfc9e0fd69599c4e4a1fe62dd708a8030efd"},{"byteSize":52364,"path":"route/canonical-route.json","sha256":"62d526cc4094ce3cf4621856709550520074142520ba13c5baa18b99ca6cf2d6"},{"byteSize":31,"path":"route/media-index.json","sha256":"9f1a21f3872c8655bb71bcc8fe4abfc9e0fd69599c4e4a1fe62dd708a8030efd"},{"byteSize":8644,"path":"route/route-thread.glb","sha256":"301e6c956b73ccf4f742f634b1ece16acd49c340297e3bbf4288025707cca54f"},{"byteSize":855,"path":"runtime/world.json","sha256":"bb8a5664e01c478a0c1df8ac2e6f8966873496b787653871d4ddd37000f98d08"},{"byteSize":647992,"path":"sources/derived/normalized-terrain.json","sha256":"3535a39ced71776e6b64cd1eebf04b12110e352e0d27850f2482ac838ef1009d"},{"byteSize":1630051,"path":"sources/derived/osm-route-world.json","sha256":"ab04ebbcf9c28796e73185cc1b186e47d1afda36f2ff9474282b2fd38684134e"},{"byteSize":3417,"path":"sources/inventory.json","sha256":"64a05282c35e905adacff109e4930b17a1c409a46763bd969cbcbc4e9cc0a3bb"},{"byteSize":1818392,"path":"sources/original/osm-overpass/000.json","sha256":"f46c517bc56784b98da978dbe494ee445b7dbad9b82bd4e369c5ee4390f55052"},{"byteSize":2014318,"path":"sources/original/osm-overpass/001.json","sha256":"d7550333c11928d84c2e2d5411eaf7bb0aa51e5f6cc422d28ba6a0d943500609"},{"byteSize":52331,"path":"sources/original/route-detail.json","sha256":"666e7bcc2b7214ca24703ecd66470a963af1df1e11b5bc9fbc182258aba820f6"},{"byteSize":56,"path":"structures/tileset.json","sha256":"f3734f2797a87ed0aa330b85d06e55a7e3821fc7ca6be7bb283afd5fde35d260"},{"byteSize":5518808,"path":"terrain/surface/core-terrain.glb","sha256":"c8d4758e3b31a3976c83be79033f0e55dd4a7af4064acad2a44ae569e0fab74b"},{"byteSize":886729,"path":"transportation/network.json","sha256":"fc6ee4c98fb9313682df962ef58b71745647a389b6ba3b2026713cfb51197a6a"}],"packId":"wp_05202b59d818c60bf93a5b7def1b16c840d77faba87c0f1aa8c36ee5eacdcffe","schemaVersion":1}
