{"algorithm":"sha256","files":[{"byteSize":4088,"path":"cinematic/camera-timelines.json","sha256":"bb81f64f79c7ca68079bd4e762f7b308d8f363dd910426cc1625b4afa4516256"},{"byteSize":429,"path":"cinematic/experience-manifest.json","sha256":"6564533b71f1af81dc97c1025bd6d7c50e1acd0886cbc519a615ed38cbc03844"},{"byteSize":78,"path":"cinematic/poster-candidates.json","sha256":"4424c34a0c4e771e5a230c54335d9c1fe6d6c6a75bd53260f79aa4bc87939367"},{"byteSize":109,"path":"imagery/materials/procedural.json","sha256":"576c10eaf5c9916fe8bee7e7116b9bb2a7c867aabdc705d4d2c83c00cc398775"},{"byteSize":191,"path":"lod/core.json","sha256":"323c35f77fac7f0be4736d750ef198f6ac104b05d4195c43c7d104e9a363234b"},{"byteSize":10019,"path":"manifest.json","sha256":"fa4172eb9ab1fee422830e05787eebfbed1d83633f83d97361d79ce5dcc34830"},{"byteSize":98,"path":"migrations/version.json","sha256":"9d1f6bcfb08424a33d8d6440340558cc9935e57e58d16db1d1aa06b62189703a"},{"byteSize":208,"path":"physics/structures-collision.glb","sha256":"730ba806edfe2a40fa729cc33ffd02ff1f74e19267726c40701b848d687151a3"},{"byteSize":25408,"path":"physics/terrain-collision.glb","sha256":"a6c3c472be018108ec367119ddde5cc8fb10fc2968aeefdeeedc554e8f137bf4"},{"byteSize":10500,"path":"physics/traversable-surfaces.glb","sha256":"c6655e7103f6186a85f324827d59fcbe5fb614bc2365261d7534105cb42e6bbb"},{"byteSize":51262,"path":"physics/world-navigation.json","sha256":"079d764dc0a764cf81f83b9fb9076146e15fe41b66015fb44d150ac891a31b48"},{"byteSize":191,"path":"provenance/accuracy.json","sha256":"3e0aa4322e5d8d3f0db312cbdfcc73289dc53f81b52533b763c53291288f5654"},{"byteSize":275,"path":"provenance/attribution.json","sha256":"fd6392193c63238f796a93a5e716447e8adf3a89aaaceebe55942e9aa87827d3"},{"byteSize":430162,"path":"provenance/coverage.json","sha256":"c82b134e98e0743b4413520acdfbc1a98d02b8f429a0187a208dc6638b3467ec"},{"byteSize":8121,"path":"provenance/transformations.json","sha256":"8cb3dee6d2d26cd29bd819f3d853825fecd4dfbc5daf3a14b87528fa257026d5"},{"byteSize":56,"path":"reconstruction/inventory.json","sha256":"d3038a11fa3116de04981567121106ac976237e09a50576a670d6b454c7d1298"},{"byteSize":31,"path":"route/annotations.json","sha256":"9f1a21f3872c8655bb71bcc8fe4abfc9e0fd69599c4e4a1fe62dd708a8030efd"},{"byteSize":27977,"path":"route/canonical-route.json","sha256":"6bb4d7c336df27935c93c46be4ec9611ad2b82247eee8bfe682e0e4c0cb538fa"},{"byteSize":31,"path":"route/media-index.json","sha256":"9f1a21f3872c8655bb71bcc8fe4abfc9e0fd69599c4e4a1fe62dd708a8030efd"},{"byteSize":3020,"path":"route/route-thread.glb","sha256":"c1d8274f18f2bccf6a7ae3274c48b22cd6357b83daf7ae3648969d916d4be62e"},{"byteSize":682,"path":"runtime/world.json","sha256":"7d9490b3e9b22b6e74a915b0cb151be6feb338bc5f1a12a3bfe861661a3ae622"},{"byteSize":626,"path":"sources/inventory.json","sha256":"c973610497f972abac6cb8679bed6df084cfda020bcc4eb9e590872f68c14be0"},{"byteSize":28577,"path":"sources/original/route-detail.json","sha256":"e3b686096040cc905228fe9cacce67d625ed1b68f06d7c27c5381175e586bf63"},{"byteSize":56,"path":"structures/tileset.json","sha256":"f3734f2797a87ed0aa330b85d06e55a7e3821fc7ca6be7bb283afd5fde35d260"},{"byteSize":25408,"path":"terrain/surface/core-terrain.glb","sha256":"a8df0a6efc7db7a167d21947a5939360e1dca4438829e112bc667cd6eb1ae94a"},{"byteSize":159,"path":"transportation/network.json","sha256":"8a5b1579f878740b032eda0ebd04c72d5323a508b24ddb477b3fe187268694d6"}],"packId":"wp_ce46252091affe7c3f8f6de14fe6cf852b82b990716ba02b1f27ad391f7de68a","schemaVersion":1}
